{
  "stageTitle": "测试",
  "summary": {
      "text": "这部分仍需努力............................",
      "abilityRating": 1
    },
  "mastered": [
    {
      "point":"12",
      "evidence": "掌握了什么的依据（如：某次检验通过表现/该节点作答情况）"
    }
  ],
  "needsAttention": [
    {
      "point": "32",
      "reason": "为什么需要注意（易错点/薄弱点，可用检验记录佐证）"
    }
  ],
  "nextStep":[
    {
      "action": "可执行动作（做什么练习/复习什么/在下一个阶段怎么学）",
      "reason": "........"
    }
  ]
}